617,How might we derive at altitude?
618,How might we barricade at altitude?
619,How might we consume at altitude?
620,How might we malfunction at altitude?
621,How might we accede at altitude?
622,How might we pronounce at altitude?
623,How might we bide at altitude?
624,How might we induce at altitude?
625,How might we quell at altitude?
626,How might we plump at altitude?
627,How might we enroll at altitude?
628,How might we hail at altitude?
629,How might we persist at altitude?
630,How might we abstain at altitude?
631,How might we intercept at altitude?
632,How might we resurrect at altitude?
633,How might we foreswear at altitude?
634,How might we suffice at altitude?
635,How might we unmake at altitude?
636,How might we condescend at altitude?
637,How might we defy at altitude?
638,How might we depart at altitude?
639,How might we heighten at altitude?
640,How might we embark at altitude?
641,How might we descend at altitude?
642,How might we discontinue at altitude?
643,How might we ascend at altitude?
644,How might we dislike the machine/mechanism?
645,How might we dislike the machine/mechanism?
646,How might we dislike the machine/mechanism?
647,How might we originate the machine/mechanism?
648,How might we embody the machine/mechanism?
649,How might we beget the machine/mechanism?
650,How might we entrust the machine/mechanism?
651,How might we bequeath the machine/mechanism?
652,How might we allege the machine/mechanism?
653,How might we perplex the machine/mechanism?
654,How might we baby-sit the machine/mechanism?
655,How might we scram the machine/mechanism?
656,How might we pronounce the machine/mechanism?
657,How might we impart the machine/mechanism?
658,How might we induce the machine/mechanism?
659,How might we terrify head <?
660,How might we abstain head <?
661,How might we agitate head <?
662,How might we stimulate head <?
663,How might we abstain head <?
664,How might we malfunction head <?
665,How might we embody head <?
666,How might we rifle head <?
667,How might we neglect head <?
668,How might we derive head <?
669,How might we barricade head <?
670,How might we consume head <?
671,How might we stir head <?
672,How might we malfunction head <?
673,How might we induce head <?
674,How might we provoke head <?
675,How might we crusade head <?
676,How might we plump head <?
677,How might we hail head <?
678,How might we stimulate head <?
679,How might we flee head <?
680,How might we abstain head <?
681,How might we agitate head <?
682,How might we intercept head <?
683,How might we terrify head <?
684,How might we defy head <?
685,How might we vanish head <?
686,How might we dismiss head <?
687,How might we discontinue head <?
688,How might we sedate head <?
689,How might we astound flight attendants?
690,How might we backups. flight attendants?
691,How might we obviate flight attendants?
692,How might we abstain flight attendants?
693,How might we embody flight attendants?
694,How might we allege flight attendants?
695,How might we consume flight attendants?
696,How might we debar flight attendants?
697,How might we pronounce flight attendants?
698,How might we necessitate flight attendants?
699,How might we obviate flight attendants?
700,How might we abstain flight attendants?
701,How might we defy flight attendants?
702,How might we amaze flight attendants?
703,How might we induce flight attendants?
704,How might we obviate the pilots?
705,How might we abstain the pilots?
706,How might we disclaim the pilots?
707,How might we unmake the pilots?
708,How might we abstain the pilots?
709,How might we malfunction the pilots?
710,How might we unmake the pilots?
711,How might we unmake the pilots?
712,How might we palpate the pilots?
713,How might we embody the pilots?
714,How might we rifle the pilots?
715,How might we derive the pilots?
716,How might we barricade the pilots?
717,How might we consume the pilots?
718,How might we malfunction the pilots?
719,How might we induce the pilots?
720,How might we plump the pilots?
721,How might we disclaim the pilots?
722,How might we hail the pilots?
723,How might we flee the pilots?
724,How might we impart the pilots?
725,How might we necessitate the pilots?
726,How might we abstain the pilots?
727,How might we intercept the pilots?
728,How might we suffice the pilots?
729,How might we debar the pilots?
730,How might we obviate the pilots?
731,How might we unmake the pilots?
732,How might we defy the pilots?
733,How might we commend the pilots?
734,How might we educate the pilots?
735,How might we commemorate the pilots?
736,How might we vanish the pilots?
737,How might we discontinue the pilots?
738,How might we unmake well-versed in?
739,How might we unmake something dire?
740,How might we abstain well-versed in?
741,How might we abstain something dire?
742,How might we embody well-versed in?
743,How might we embody something dire?
744,How might we suffice well-versed in?
745,How might we suffice something dire?
746,How might we allege well-versed in?
747,How might we allege something dire?
748,How might we wield well-versed in?
749,How might we wield something dire?
750,How might we consume well-versed in?
751,How might we consume something dire?
752,How might we pronounce well-versed in?
753,How might we pronounce something dire?
754,How might we unmake well-versed in?
755,How might we unmake something dire?
756,How might we abstain well-versed in?
757,How might we abstain something dire?
758,How might we defy well-versed in?
759,How might we defy something dire?
760,How might we postdate well-versed in?
761,How might we postdate something dire?
762,How might we induce well-versed in?
763,How might we induce something dire?
764,How might we surveil well-versed in?
765,How might we surveil something dire?
766,How might we precede well-versed in?
767,How might we precede something dire?
768,How might we downgrade on JetBlue?
769,How might we demote on JetBlue?
770,How might we abstain on JetBlue?
771,How might we malfunction on JetBlue?
772,How might we discontinue on JetBlue?
773,How might we abstain on JetBlue?
774,How might we demote on JetBlue?
775,How might we inflame on JetBlue?
776,How might we rifle on JetBlue?
777,How might we derive on JetBlue?
778,How might we distinguish on JetBlue?
779,How might we barricade on JetBlue?
780,How might we consume on JetBlue?
781,How might we restrain on JetBlue?
782,How might we malfunction on JetBlue?
783,How might we misplace on JetBlue?
784,How might we pause on JetBlue?
785,How might we induce on JetBlue?
786,How might we transgress on JetBlue?
787,How might we fracture on JetBlue?
788,How might we plump on JetBlue?
789,How might we bankrupt on JetBlue?
790,How might we hail on JetBlue?
791,How might we awaken on JetBlue?
792,How might we abstain on JetBlue?
793,How might we intercept on JetBlue?
794,How might we interrupt on JetBlue?
795,How might we dampen on JetBlue?
796,How might we downgrade on JetBlue?
797,How might we defy on JetBlue?
798,How might we discontinue on JetBlue?
799,How might we sustain on JetBlue?
800,How might we violate on JetBlue?
801,How might we abstain stressful probably <?
802,How might we vanish stressful probably <?
803,How might we consume stressful probably <?
804,How might we flee stressful probably <?
805,How might we abstain stressful probably <?
806,How might we defy stressful probably <?
807,How might we induce stressful probably <?
808,How might we palpate irrational self?
809,How might we embody irrational self?
810,How might we dismiss irrational self?
811,How might we neglect irrational self?
812,How might we include accelerated stalls?
813,How might we be accelerated stalls?
814,How might we have accelerated stalls?
815,How might we train accelerated stalls?
816,How might we call accelerated stalls?
817,How might we stall accelerated stalls?
818,How might we angle accelerated stalls?
819,How might we pull accelerated stalls?
820,How might we exclude accelerated stalls?
821,How might we exclude accelerated stalls?
822,How might we exclude accelerated stalls?
823,How might we differ accelerated stalls?
824,How might we lack accelerated stalls?
825,How might we abstain accelerated stalls?
826,How might we refuse accelerated stalls?
827,How might we push accelerated stalls?
828,How might we repel accelerated stalls?
829,How might we cost accelerated stalls?
830,How might we suffer accelerated stalls?
831,How might we exclude accelerated stalls?
832,How might we tug accelerated stalls?
833,How might we fish accelerated stalls?
834,How might we disgust accelerated stalls?
835,How might we coach accelerated stalls?
836,How might we rebuff accelerated stalls?
837,How might we take accelerated stalls?
838,How might we pluck accelerated stalls?
839,How might we reject accelerated stalls?
840,How might we have accelerated stalls?
841,How might we rend accelerated stalls?
842,How might we embody accelerated stalls?
843,How might we predict accelerated stalls?
844,How might we advertise accelerated stalls?
845,How might we press accelerated stalls?
846,How might we prepare accelerated stalls?
847,How might we train accelerated stalls?
848,How might we include accelerated stalls?
849,How might we eject accelerated stalls?
850,How might we resist accelerated stalls?
851,How might we extract accelerated stalls?
852,How might we bar accelerated stalls?
853,How might we procrastinate accelerated stalls?
854,How might we slant accelerated stalls?
855,How might we pull accelerated stalls?
856,How might we attract accelerated stalls?
857,How might we repel accelerated stalls?
858,How might we receive accelerated stalls?
859,How might we equal accelerated stalls?
860,How might we crusade accelerated stalls?
861,How might we angle accelerated stalls?
862,How might we constitute accelerated stalls?
863,How might we consume accelerated stalls?
864,How might we draw accelerated stalls?
865,How might we refuse accelerated stalls?
866,How might we deny accelerated stalls?
867,How might we bid accelerated stalls?
868,How might we differ accelerated stalls?
869,How might we exist accelerated stalls?
870,How might we own accelerated stalls?
871,How might we perpetrate accelerated stalls?
872,How might we hold accelerated stalls?
873,How might we miss accelerated stalls?
874,How might we disagree accelerated stalls?
875,How might we experience accelerated stalls?
876,How might we visit accelerated stalls?
877,How might we name accelerated stalls?
878,How might we lean accelerated stalls?
879,How might we abstain accelerated stalls?
880,How might we defy accelerated stalls?
881,How might we accept accelerated stalls?
882,How might we be accelerated stalls?
883,How might we induce accelerated stalls?
884,How might we aim accelerated stalls?
885,How might we educate accelerated stalls?
886,How might we push accelerated stalls?
887,How might we trail accelerated stalls?
888,How might we admit accelerated stalls?
889,How might we stall accelerated stalls?
890,How might we get accelerated stalls?
891,How might we discipline accelerated stalls?
892,How might we call accelerated stalls?
893,How might we shout accelerated stalls?
894,How might we address accelerated stalls?
895,How might we palpate ingrained in?
896,How might we embody ingrained in?
897,How might we discontinue about <?
898,How might we reassure about <?
899,How might we reassure about <?
900,How might we reassure about <?
901,How might we demote about <?
902,How might we fracture about <?
903,How might we embody about <?
904,How might we interrupt about <?
905,How might we discontinue about <?
906,How might we dampen about <?
907,How might we bankrupt about <?
908,How might we restrain about <?
909,How might we tease about <?
910,How might we misplace about <?
911,How might we reassure about <?
912,How might we sustain about <?
913,How might we pause about <?
914,How might we violate about <?
915,How might we transgress about <?
916,How might we abstain most <?
917,How might we abstain most <?
918,How might we abstain most <?
919,How might we dematerialize most <?
920,How might we dematerialise most <?
921,How might we disinherit most <?
922,How might we unmake most <?
923,How might we embody most <?
924,How might we suffice most <?
925,How might we embark most <?
926,How might we entrust most <?
927,How might we dismiss most <?
928,How might we neglect most <?
929,How might we bequeath most <?
930,How might we dematerialize most <?
931,How might we enroll most <?
932,How might we disinherit most <?
933,How might we consume most <?
934,How might we impart most <?
935,How might we accede most <?
936,How might we unmake most <?
937,How might we abstain most <?
938,How might we defy most <?
939,How might we induce most <?
940,How might we deprive in sweat?
941,How might we uncover in sweat?
942,How might we enrich in sweat?
943,How might we malfunction in sweat?
944,How might we embrace in sweat?
945,How might we vanish in sweat?
946,How might we brood in sweat?
947,How might we palpate in sweat?
948,How might we rifle in sweat?
949,How might we plump in sweat?
950,How might we discontinue in sweat?
951,How might we derive in sweat?
952,How might we deprive in sweat?
953,How might we hail in sweat?
954,How might we barricade in sweat?
955,How might we flee in sweat?
956,How might we malfunction in sweat?
957,How might we uncover in sweat?
958,How might we enrich in sweat?
959,How might we overlay in sweat?
960,How might we intercept in sweat?
961,How might we traverse in sweat?
962,How might we shroud in sweat?
963,How might we cheaply cross oceans?
964,How might we obviate cross oceans?
965,How might we abstain cross oceans?
966,How might we disclaim cross oceans?
967,How might we vanish cross oceans?
968,How might we disclaim cross oceans?
969,How might we consume cross oceans?
970,How might we flee cross oceans?
971,How might we debar cross oceans?
972,How might we impart cross oceans?
973,How might we necessitate cross oceans?
974,How might we obviate cross oceans?
975,How might we abstain cross oceans?
976,How might we defy cross oceans?
977,How might we unmake therapist <?
978,How might we malfunction therapist <?
979,How might we abstain therapist <?
980,How might we unmake therapist <?
981,How might we malfunction therapist <?
982,How might we knead therapist <?
983,How might we ferment therapist <?
984,How might we embody therapist <?
985,How might we suffice therapist <?
986,How might we exploit therapist <?
987,How might we allege therapist <?
988,How might we consume therapist <?
989,How might we malfunction therapist <?
990,How might we pronounce therapist <?
991,How might we unmake therapist <?
992,How might we abstain therapist <?
993,How might we defy therapist <?
994,How might we induce therapist <?
995,How might we cultivate therapist <?
996,How might we sour therapist <?
997,How might we be ativan claustrophobia?
998,How might we fly ativan claustrophobia?
999,How might we prompt ativan claustrophobia?
1000,How might we seek ativan claustrophobia?
1001,How might we prescribe ativan claustrophobia?
1002,How might we help ativan claustrophobia?
1003,How might we overcome ativan claustrophobia?
1004,How might we be ativan claustrophobia?
1005,How might we have ativan claustrophobia?
1006,How might we be ativan claustrophobia?
1007,How might we prescribe ativan claustrophobia?
1008,How might we be ativan claustrophobia?
1009,How might we fly ativan claustrophobia?
1010,How might we have ativan claustrophobia?
1011,How might we cause ativan claustrophobia?
1012,How might we consider ativan claustrophobia?
1013,How might we leave ativan claustrophobia?
1014,How might we have ativan claustrophobia?
1015,How might we claustrophobia ativan claustrophobia?
1016,How might we please ativan claustrophobia?
1017,How might we differ ativan claustrophobia?
1018,How might we differ ativan claustrophobia?
1019,How might we lack ativan claustrophobia?
1020,How might we abstain ativan claustrophobia?
1021,How might we refuse ativan claustrophobia?
1022,How might we differ ativan claustrophobia?
1023,How might we differ ativan claustrophobia?
1024,How might we lack ativan claustrophobia?
1025,How might we abstain ativan claustrophobia?
1026,How might we refuse ativan claustrophobia?
1027,How might we arrive ativan claustrophobia?
1028,How might we enter ativan claustrophobia?
1029,How might we disinherit ativan claustrophobia?
1030,How might we lack ativan claustrophobia?
1031,How might we abstain ativan claustrophobia?
1032,How might we refuse ativan claustrophobia?
1033,How might we displease ativan claustrophobia?
1034,How might we cost ativan claustrophobia?
1035,How might we suffer ativan claustrophobia?
1036,How might we leave ativan claustrophobia?
1037,How might we insert ativan claustrophobia?
1038,How might we figure ativan claustrophobia?
1039,How might we take ativan claustrophobia?
1040,How might we reject ativan claustrophobia?
1041,How might we overcome ativan claustrophobia?
1042,How might we have ativan claustrophobia?
1043,How might we study ativan claustrophobia?
1044,How might we vanish ativan claustrophobia?
1045,How might we displease ativan claustrophobia?
1046,How might we embody ativan claustrophobia?
1047,How might we fly ativan claustrophobia?
1048,How might we embark ativan claustrophobia?
1049,How might we entrust ativan claustrophobia?
1050,How might we bequeath ativan claustrophobia?
1051,How might we cause ativan claustrophobia?
1052,How might we please ativan claustrophobia?
1053,How might we resist ativan claustrophobia?
1054,How might we record ativan claustrophobia?
1055,How might we serve ativan claustrophobia?
1056,How might we motivate ativan claustrophobia?
1057,How might we avail ativan claustrophobia?
1058,How might we try ativan claustrophobia?
1059,How might we view ativan claustrophobia?
1060,How might we help oneself ativan claustrophobia?
1061,How might we receive ativan claustrophobia?
1062,How might we equal ativan claustrophobia?
1063,How might we enroll ativan claustrophobia?
1064,How might we constitute ativan claustrophobia?
1065,How might we disinherit ativan claustrophobia?
1066,How might we help ativan claustrophobia?
1067,How might we consume ativan claustrophobia?
1068,How might we refuse ativan claustrophobia?
1069,How might we overwhelm ativan claustrophobia?
1070,How might we flee ativan claustrophobia?
1071,How might we deny ativan claustrophobia?
1072,How might we prompt ativan claustrophobia?
1073,How might we exit ativan claustrophobia?
1074,How might we differ ativan claustrophobia?
1075,How might we exist ativan claustrophobia?
1076,How might we consider ativan claustrophobia?
1077,How might we own ativan claustrophobia?
1078,How might we see ativan claustrophobia?
1079,How might we forget ativan claustrophobia?
1080,How might we arrive ativan claustrophobia?
1081,How might we seek ativan claustrophobia?
1082,How might we order ativan claustrophobia?
1083,How might we hold ativan claustrophobia?
1084,How might we impart ativan claustrophobia?
1085,How might we regard ativan claustrophobia?
1086,How might we miss ativan claustrophobia?
1087,How might we accede ativan claustrophobia?
1088,How might we disagree ativan claustrophobia?
1089,How might we experience ativan claustrophobia?
1090,How might we abstain ativan claustrophobia?
1091,How might we defy ativan claustrophobia?
1092,How might we accept ativan claustrophobia?
1093,How might we think ativan claustrophobia?
1094,How might we enter ativan claustrophobia?
1095,How might we be ativan claustrophobia?
1096,How might we induce ativan claustrophobia?
1097,How might we get ativan claustrophobia?
1098,How might we search ativan claustrophobia?
1099,How might we unmake mccartney i?
1100,How might we unmake an anxious flier?
1101,How might we memorize mccartney i?
1102,How might we memorize an anxious flier?
1103,How might we vanish mccartney i?
1104,How might we vanish an anxious flier?
1105,How might we suffice mccartney i?
1106,How might we suffice an anxious flier?
1107,How might we manipulate mccartney i?
1108,How might we manipulate an anxious flier?
1109,How might we allege mccartney i?
1110,How might we allege an anxious flier?
1111,How might we flee mccartney i?
1112,How might we flee an anxious flier?
1113,How might we pronounce mccartney i?
1114,How might we pronounce an anxious flier?
1115,How might we unmake mccartney i?
1116,How might we unmake an anxious flier?
1117,How might we agitate shaking xanax?
1118,How might we stimulate shaking xanax?
1119,How might we airlift shaking xanax?
1120,How might we palpate shaking xanax?
1121,How might we rustle shaking xanax?
1122,How might we embody shaking xanax?
1123,How might we plagiarize shaking xanax?
1124,How might we dally shaking xanax?
1125,How might we revoke shaking xanax?
1126,How might we judder shaking xanax?
1127,How might we descend shaking xanax?
1128,How might we hoist shaking xanax?
1129,How might we allege shaking xanax?
1130,How might we frown shaking xanax?
1131,How might we stimulate shaking xanax?
1132,How might we precipitate shaking xanax?
1133,How might we stir shaking xanax?
1134,How might we accrue shaking xanax?
1135,How might we sedate shaking xanax?
1136,How might we pronounce shaking xanax?
1137,How might we agitate shaking xanax?
1138,How might we face-lift shaking xanax?
1139,How might we induce shaking xanax?
1140,How might we provoke shaking xanax?
1141,How might we pilfer shaking xanax?
1142,How might we crusade shaking xanax?
1143,How might we obviate landing <?
1144,How might we abstain landing <?
1145,How might we disclaim landing <?
1146,How might we obviate landing <?
1147,How might we abstain landing <?
1148,How might we disclaim landing <?
1149,How might we pluck landing <?
1150,How might we disclaim landing <?
1151,How might we consume landing <?
1152,How might we debar landing <?
1153,How might we impart landing <?
1154,How might we necessitate landing <?
1155,How might we obviate landing <?
1156,How might we abstain landing <?
1157,How might we defy landing <?
1158,How might we unmake on <?
1159,How might we discourage on <?
1160,How might we discourage on <?
1161,How might we unmake on <?
1162,How might we refrain on <?
1163,How might we demote on <?
1164,How might we embody on <?
1165,How might we beget on <?
1166,How might we refrain on <?
1167,How might we allege on <?
1168,How might we discourage on <?
1169,How might we pronounce on <?
1170,How might we bide on <?
1171,How might we pause on <?
1172,How might we induce on <?
1173,How might we transgress on <?
1174,How might we quell on <?
1175,How might we memorize on <?
1176,How might we fracture on <?
1177,How might we seduce on <?
1178,How might we bequeath on <?
1179,How might we bankrupt on <?
1180,How might we warn on <?
1181,How might we flee on <?
1182,How might we persist on <?
1183,How might we impart on <?
1184,How might we stool on <?
1185,How might we abstain on <?
1186,How might we perch on <?
1187,How might we interrupt on <?
1188,How might we entrust on <?
1189,How might we heed on <?
1190,How might we dampen on <?
1191,How might we motivate on <?
1192,How might we unmake on <?
1193,How might we commend on <?
1194,How might we commemorate on <?
1195,How might we vanish on <?
1196,How might we beware on <?
1197,How might we perplex on <?
1198,How might we scram on <?
1199,How might we deter on <?
1200,How might we violate on <?
1201,How might we rationalise an incredibly irrational?
1202,How might we refrain an incredibly irrational?
1203,How might we obviate an incredibly irrational?
1204,How might we obviate an incredibly irrational?
1205,How might we abstain an incredibly irrational?
1206,How might we disclaim an incredibly irrational?
1207,How might we evolve an incredibly irrational?
1208,How might we originate an incredibly irrational?
1209,How might we embody an incredibly irrational?
1210,How might we refrain an incredibly irrational?
1211,How might we consume an incredibly irrational?
1212,How might we bide an incredibly irrational?
1213,How might we apologize an incredibly irrational?
1214,How might we quell an incredibly irrational?
1215,How might we disclaim an incredibly irrational?
1216,How might we explicate an incredibly irrational?
1217,How might we flee an incredibly irrational?
1218,How might we persist an incredibly irrational?
1219,How might we impart an incredibly irrational?
1220,How might we necessitate an incredibly irrational?
1221,How might we abstain an incredibly irrational?
1222,How might we perch an incredibly irrational?
1223,How might we modernize an incredibly irrational?
1224,How might we motivate an incredibly irrational?
1225,How might we debar an incredibly irrational?
1226,How might we obviate an incredibly irrational?
1227,How might we defy an incredibly irrational?
1228,How might we imply an incredibly irrational?
1229,How might we vanish an incredibly irrational?
1230,How might we compose an incredibly irrational?
1231,How might we rationalize an incredibly irrational?
1232,How might we avail an incredibly irrational?
1233,How might we depart the reactors?
1234,How might we abstain the reactors?
1235,How might we originate the reactors?
1236,How might we sidetrack the reactors?
1237,How might we embody the reactors?
1238,How might we allege the reactors?
